timestamp,store_id,customer_voice
2024-07-01 1:33:47,1,夜遅くまで営業しているので助かります。
2024-07-02 13:00:01,1,プライベートブランドの価格がもっと安ければ嬉しい。
2024-07-03 7:34:30,1,プライベートブランド商品の種類を増やしてほしい。
2024-07-04 2:08:59,1,特売やクーポンの頻度を増やしてほしい。
2024-07-05 20:43:28,1,スタッフの方の対応が親切で丁寧で、気持ちよく買い物ができます。
2024-07-07 15:17:57,1,ポイントカードの還元率がもう少し高ければ嬉しいです。
2024-07-09 9:52:26,1,海外コスメの取り扱いが少ない。もっと種類を増やしてほしい。
2024-07-11 4:26:55,1,ベビー用品の品揃えが豊富で助かる。
2024-07-12 23:01:24,1,ポイントの使い道がもっと増えれば嬉しい。
2024-07-14 17:35:53,1,トイレットペーパーやティッシュペーパーなどの日用品の価格を下げてほしい。
2024-07-16 12:10:22,1,洗剤や柔軟剤の特売をもっと頻繁にしてほしい。
2024-07-18 6:44:51,3,スタッフの方の接客態度がもっと丁寧だと嬉しい。
2024-07-20 1:19:20,1,スタッフの方の笑顔がもっと見たい。
2024-07-01 9:52:26,2,ベビーカーやチャイルドシートのレンタルがあると助かる。
2024-07-02 12:16:55,2,ジェネリック医薬品の還元率を上げてほしい。
2024-07-04 19:30:22,2,サプリメントや健康食品の価格を見直してほしい。
2024-07-07 2:43:49,2,他店と比べて全体的に価格が高いように感じます。もう少し価格を下げて頂けると助かります。
2024-07-09 9:57:16,2,薬剤師の方の専門的なアドバイスが役に立ちました。
2024-07-11 17:10:43,2,ジェネリック医薬品の品揃えが充実している。
2024-07-14 0:24:10,2,エコ商品の取り扱いを増やしてほしい。
2024-07-16 7:37:37,2,特定のメーカーの商品が取り扱っていないのが残念です。取り扱い商品の幅を広げて頂けると嬉しいです。
2024-07-18 14:51:04,2,駐輪場が広く、車でも買い物しやすいです。
2024-07-19 0:19:20,2,医療機器の品揃えも充実してほしい。
2024-07-19 9:47:36,2,スタッフの方の商品の知識が豊富で助かる。
2024-07-20 4:44:08,2,ベビー服やベビーフードの品揃えを充実してほしい。
2024-07-21 9:08:56,2,風邪薬や頭痛薬などのOTC医薬品の価格を下げてほしい。
2024-07-22 23:40:40,2,セルフレジをもっと増やしてほしい。
2024-07-24 14:12:24,2,店内が広く、通路も広くて買い物しやすいです。
2024-07-26 4:44:08,2,清潔感があり、気持ちよく買い物ができます。
2024-07-27 19:15:52,2,オンラインストアで注文した商品を店舗で受け取れるサービスがあると便利です。
2024-07-29 9:47:36,2,デパコスブランドの取り扱いがあると嬉しい。
2024-07-01 0:19:20,3,子供連れでも入りやすい雰囲気です。
2024-07-02 9:47:36,3,漢方薬の種類が豊富で助かる。
2024-07-03 19:15:52,3,特売の対象商品をもっと増やしてほしい。
2024-07-05 4:44:08,3,スタッフの方のレジ操作をもっとスムーズにしてほしい。
2024-07-06 14:12:24,3,レジが混雑して待ち時間が長い。
2024-07-07 23:40:40,3,ピーク時の混雑を解消してほしい。
2024-07-09 9:08:56,3,欲しい商品がいつも品切れで、他のドラッグストアに行くことが多々あります。品揃えの改善をお願いします。
2024-07-10 18:37:12,3,特売品が少なく、他のドラッグストアの方がお得な印象があります。特売の頻度を増やして頂けると嬉しいです。
2024-07-12 4:05:28,3,サンプルやテスターがもっと充実していると助かる。
2024-07-13 13:33:44,3,ペット用品の種類ももっと増やしてほしい。
2024-07-14 23:02:00,3,ポイントカードの還元率をもっと上げてほしい。
2024-07-15 2:12:13,3,スタッフの方のレジの操作が迅速でスムーズ。
2024-07-15 5:22:26,3,スタッフの方の健康食品に関する知識がもっと豊富だと助かる。
2024-07-17 8:32:39,3,スタッフの方の化粧品に関するアドバイスが欲しい。
2024-07-19 11:42:52,3,スタッフの方の医薬品に関する知識をもっと深めてほしい。
2024-07-21 14:53:05,3,おむつの種類を増やしてほしい。
2024-07-23 8:03:18,3,シャンプーやリンスの詰め替え用をもっと安く販売してほしい。
2024-07-25 1:13:31,3,レジの待ち時間が長い。
2024-07-26 18:23:44,3,土日は店内が混雑して買い物しにくい。
2024-07-28 11:33:57,3,スタッフの方の私語が気になることがある。
2024-07-01 11:16:08,2,冷凍食品や総菜の種類を増やしてほしいです。
2024-07-02 19:59:54,2,オーガニック食品や健康食品のコーナーをもっと充実させてほしいです。
2024-07-03 6:34:40,1,商品の陳列場所がわかりにくいので、案内板があると助かります。
2024-07-04 15:12:27,1,商品の在庫状況をアプリなどで確認できるようにしてほしいです。
2024-07-05 10:47:13,1,オンラインショップで注文した商品を店舗で受け取れるようにしてほしいです。
2024-07-06 19:20:59,2,宅配サービスが始まったのでとても便利です。エリアを更に拡大してほしいです。
2024-07-07 4:55:45,2,駐車場がもう少し広ければ嬉しいです。
2024-07-08 13:39:31,1,駐輪場が屋根付きだと雨の日でも安心です。
2024-07-09 9:24:17,1,店内にカフェスペースがあると嬉しいです。
2024-07-10 18:07:04,1,無料Wi-Fiがあると便利です。
2024-07-11 3:41:50,3,清掃の方は店内をもう少しきれいに掃除してほしいです。
2024-07-12 12:26:36,1,多目的トイレがあると助かります。
2024-07-13 8:11:22,1,エレベーターがあると高齢者や体の不自由な方でも利用しやすいです。
2024-07-14 16:54:09,1,エスカレーターの速度がもう少し遅いと安心です。
2024-07-15 2:28:55,3,店内BGMの音量が大きすぎるので、もう少し小さくしてほしいです。
2024-07-16 11:13:41,3,レジの方の声が聞き取りにくいので、もう少しクリアにしてほしいです。
2024-07-17 19:57:28,3,商品の価格表示が小さくて見にくいので、もう少し大きくしてほしいです。
2024-07-18 5:32:14,1,商品の説明書きがもっと詳しいと嬉しいです。
2024-07-19 14:16:01,2,アレルギー表示が分かりやすいのでいつも助かっています。
2024-07-20 9:59:47,2,商品の原産国表示をもっとわかりやすくしてほしいです。
2024-07-21 18:43:33,1,リサイクルボックスの種類を増やしてほしいです。
2024-07-22 4:18:19,1,エコバッグの販売コーナーをもっと目立つ場所に設置してほしいです。
2024-07-23 13:02:05,2,環境に配慮した商品をもっと増やしてほしいです。
2024-07-24 8:45:51,1,地域貢献活動に積極的に取り組んでいる姿勢が良いと思います。
2024-07-25 17:29:37,3,ポイントカードなどの特典について詳しくない店員さんが多いので、ちゃんと教育してほしいです。
2024-07-26 3:14:23,2,クーポンや割引券をもっとたくさん発行してほしいです。
2024-07-27 12:58:09,2,誕生日特典があると嬉しいです。
2024-07-28 9:41:55,2,アプリの使い勝手を良くしてほしいです。
2024-07-29 18:25:41,1,SNSでの情報発信をもっと活発にしてほしいです。
2024-07-30 4:09:27,3,店員さんもお客様の声をもっと反映してほしいです。
2024-07-31 13:53:13,2,これからも利用させていただきます。
2024-07-21 10:25:38,3,医薬品の相談をもっと気軽にできる雰囲気だと助かります。
2024-07-22 18:52:14,1,化粧品のテスターがもっと充実していると嬉しいです。
2024-07-23 5:17:09,1,試供品がいつもたくさんあるのが嬉しいので是非続けていただきたいです。
2024-07-24 14:33:56,1,レジ袋有料化は良い取り組みだと思います。
2024-07-25 9:08:42,3,レジの待ち時間が長いので、もう少し早く対応してほしいです。
2024-07-26 16:41:29,1,セルフレジの台数を増やしてほしいです。
2024-07-27 3:27:15,3,店内がもう少し広いと買い物しやすいです。
2024-07-28 12:55:03,1,通路が狭くてベビーカーでの移動が大変です。
2024-07-29 8:19:48,1,授乳室やおむつ交換台があると助かります。
2024-07-30 17:02:35,2,キッズスペースがあると子供が退屈しなくて嬉しいです。
2024-07-31 2:38:21,1,ペット用品の品揃えを充実させてほしいです。